{
  "receiptVersion": "marshal-operator-codex-provider-schema-preflight/v1",
  "status": "pass",
  "reasonCode": "codex-provider-schema-compatible",
  "adapterId": "codex",
  "cliCompatibilityLine": "0.145.x",
  "authorityScope": "mac-ordinary-user-operator-local",
  "authorityClaim": "none",
  "profileVersion": "marshal-operator-codex-provider-schema-profile/v1",
  "profileDigest": "sha256:0000000000000000000000000000000000000000000000000000000000000000",
  "rulesDigest": "sha256:0000000000000000000000000000000000000000000000000000000000000000",
  "schema": {
    "path": "ABSOLUTE/PATH/MUST/BE/REPLACED/WITH/CLEAN/RELATIVE/PATH.json",
    "rawDigest": "sha256:0000000000000000000000000000000000000000000000000000000000000000",
    "rawBytes": 1,
    "nofollow": true,
    "boundedRead": true
  },
  "issueCount": 0,
  "issues": []
}
